No.     Time           Source                Destination           Protocol Length Info
     88 16.963659      10.0.0.200            10.0.0.100            Modbus/TCP 107       Query: Trans:     1; Unit:   1, Func:  16: Write Multiple Registers

Frame 88: 107 bytes on wire (856 bits), 107 bytes captured (856 bits) on interface \Device\NPF_{EFB199C7-A164-4748-BBF5-7ACCADB51238}, id 0
    Interface id: 0 (\Device\NPF_{EFB199C7-A164-4748-BBF5-7ACCADB51238})
    Encapsulation type: Ethernet (1)
    Arrival Time: Aug 16, 2022 17:35:48.663357000 Malay Peninsula Standard Time
    [Time shift for this packet: 0.000000000 seconds]
    Epoch Time: 1660642548.663357000 seconds
    [Time delta from previous captured frame: 0.246353000 seconds]
    [Time delta from previous displayed frame: 0.000000000 seconds]
    [Time since reference or first frame: 16.963659000 seconds]
    Frame Number: 88
    Frame Length: 107 bytes (856 bits)
    Capture Length: 107 bytes (856 bits)
    [Frame is marked: False]
    [Frame is ignored: False]
    [Protocols in frame: eth:ethertype:ip:tcp:mbtcp:modbus]
    [Coloring Rule Name: TCP]
    [Coloring Rule String: tcp]
Ethernet II, Src: ASUSTekC_8f:dc:39 (04:d4:c4:8f:dc:39), Dst: Lantroni_da:27:10 (00:80:a3:da:27:10)
    Destination: Lantroni_da:27:10 (00:80:a3:da:27:10)
        Address: Lantroni_da:27:10 (00:80:a3:da:27:10)
        .... ..0. .... .... .... .... = LG bit: Globally unique address (factory default)
        .... ...0 .... .... .... .... = IG bit: Individual address (unicast)
    Source: ASUSTekC_8f:dc:39 (04:d4:c4:8f:dc:39)
        Address: ASUSTekC_8f:dc:39 (04:d4:c4:8f:dc:39)
        .... ..0. .... .... .... .... = LG bit: Globally unique address (factory default)
        .... ...0 .... .... .... .... = IG bit: Individual address (unicast)
    Type: IPv4 (0x0800)
Internet Protocol Version 4, Src: 10.0.0.200, Dst: 10.0.0.100
    0100 .... = Version: 4
    .... 0101 = Header Length: 20 bytes (5)
    Differentiated Services Field: 0x00 (DSCP: CS0, ECN: Not-ECT)
    Total Length: 93
    Identification: 0xb26d (45677)
    Flags: 0x40, Don't fragment
    ...0 0000 0000 0000 = Fragment Offset: 0
    Time to Live: 128
    Protocol: TCP (6)
    Header Checksum: 0x0000 [validation disabled]
    [Header checksum status: Unverified]
    Source Address: 10.0.0.200
    Destination Address: 10.0.0.100
Transmission Control Protocol, Src Port: 49853, Dst Port: 502, Seq: 1, Ack: 1, Len: 53
Modbus/TCP
    Transaction Identifier: 1
    Protocol Identifier: 0
    Length: 47
    Unit Identifier: 1
Modbus
    .001 0000 = Function Code: Write Multiple Registers (16)
    Reference Number: 56
    Word Count: 20
    Byte Count: 40
    Register 56 (UINT16): 0
    Register 57 (UINT16): 0
    Register 58 (UINT16): 0
    Register 59 (UINT16): 0
    Register 60 (UINT16): 0
    Register 61 (UINT16): 0
    Register 62 (UINT16): 0
    Register 63 (UINT16): 0
    Register 64 (UINT16): 0
    Register 65 (UINT16): 0
    Register 66 (UINT16): 0
    Register 67 (UINT16): 0
    Register 68 (UINT16): 0
    Register 69 (UINT16): 0
    Register 70 (UINT16): 0
    Register 71 (UINT16): 0
    Register 72 (UINT16): 0
    Register 73 (UINT16): 0
    Register 74 (UINT16): 0
    Register 75 (UINT16): 0
[Community ID: 1:PSBG9yJ0UQuB1PGFiuhe+YtZcTA=]

No.     Time           Source                Destination           Protocol Length Info
     94 16.977012      10.0.0.100            10.0.0.200            Modbus/TCP 66     Response: Trans:     1; Unit:   1, Func:  16: Write Multiple Registers

Frame 94: 66 bytes on wire (528 bits), 66 bytes captured (528 bits) on interface \Device\NPF_{EFB199C7-A164-4748-BBF5-7ACCADB51238}, id 0
    Interface id: 0 (\Device\NPF_{EFB199C7-A164-4748-BBF5-7ACCADB51238})
    Encapsulation type: Ethernet (1)
    Arrival Time: Aug 16, 2022 17:35:48.676710000 Malay Peninsula Standard Time
    [Time shift for this packet: 0.000000000 seconds]
    Epoch Time: 1660642548.676710000 seconds
    [Time delta from previous captured frame: 0.001980000 seconds]
    [Time delta from previous displayed frame: 0.013353000 seconds]
    [Time since reference or first frame: 16.977012000 seconds]
    Frame Number: 94
    Frame Length: 66 bytes (528 bits)
    Capture Length: 66 bytes (528 bits)
    [Frame is marked: False]
    [Frame is ignored: False]
    [Protocols in frame: eth:ethertype:ip:tcp:mbtcp:modbus]
    [Coloring Rule Name: TCP]
    [Coloring Rule String: tcp]
Ethernet II, Src: Lantroni_da:27:10 (00:80:a3:da:27:10), Dst: ASUSTekC_8f:dc:39 (04:d4:c4:8f:dc:39)
    Destination: ASUSTekC_8f:dc:39 (04:d4:c4:8f:dc:39)
        Address: ASUSTekC_8f:dc:39 (04:d4:c4:8f:dc:39)
        .... ..0. .... .... .... .... = LG bit: Globally unique address (factory default)
        .... ...0 .... .... .... .... = IG bit: Individual address (unicast)
    Source: Lantroni_da:27:10 (00:80:a3:da:27:10)
        Address: Lantroni_da:27:10 (00:80:a3:da:27:10)
        .... ..0. .... .... .... .... = LG bit: Globally unique address (factory default)
        .... ...0 .... .... .... .... = IG bit: Individual address (unicast)
    Type: IPv4 (0x0800)
Internet Protocol Version 4, Src: 10.0.0.100, Dst: 10.0.0.200
    0100 .... = Version: 4
    .... 0101 = Header Length: 20 bytes (5)
    Differentiated Services Field: 0x00 (DSCP: CS0, ECN: Not-ECT)
    Total Length: 52
    Identification: 0xaaad (43693)
    Flags: 0x40, Don't fragment
    ...0 0000 0000 0000 = Fragment Offset: 0
    Time to Live: 64
    Protocol: TCP (6)
    Header Checksum: 0x7aeb [validation disabled]
    [Header checksum status: Unverified]
    Source Address: 10.0.0.100
    Destination Address: 10.0.0.200
Transmission Control Protocol, Src Port: 502, Dst Port: 49853, Seq: 1, Ack: 54, Len: 12
Modbus/TCP
    Transaction Identifier: 1
    Protocol Identifier: 0
    Length: 6
    Unit Identifier: 1
Modbus
    .001 0000 = Function Code: Write Multiple Registers (16)
    [Request Frame: 88]
    [Time from request: 0.013353000 seconds]
    Reference Number: 56
    Word Count: 20
[Community ID: 1:PSBG9yJ0UQuB1PGFiuhe+YtZcTA=]

No.     Time           Source                Destination           Protocol Length Info
     95 16.985552      10.0.0.200            10.0.0.100            Modbus/TCP 66        Query: Trans:     2; Unit:   1, Func:   3: Read Holding Registers

Frame 95: 66 bytes on wire (528 bits), 66 bytes captured (528 bits) on interface \Device\NPF_{EFB199C7-A164-4748-BBF5-7ACCADB51238}, id 0
    Interface id: 0 (\Device\NPF_{EFB199C7-A164-4748-BBF5-7ACCADB51238})
    Encapsulation type: Ethernet (1)
    Arrival Time: Aug 16, 2022 17:35:48.685250000 Malay Peninsula Standard Time
    [Time shift for this packet: 0.000000000 seconds]
    Epoch Time: 1660642548.685250000 seconds
    [Time delta from previous captured frame: 0.008540000 seconds]
    [Time delta from previous displayed frame: 0.008540000 seconds]
    [Time since reference or first frame: 16.985552000 seconds]
    Frame Number: 95
    Frame Length: 66 bytes (528 bits)
    Capture Length: 66 bytes (528 bits)
    [Frame is marked: False]
    [Frame is ignored: False]
    [Protocols in frame: eth:ethertype:ip:tcp:mbtcp:modbus]
    [Coloring Rule Name: TCP]
    [Coloring Rule String: tcp]
Ethernet II, Src: ASUSTekC_8f:dc:39 (04:d4:c4:8f:dc:39), Dst: Lantroni_da:27:10 (00:80:a3:da:27:10)
    Destination: Lantroni_da:27:10 (00:80:a3:da:27:10)
        Address: Lantroni_da:27:10 (00:80:a3:da:27:10)
        .... ..0. .... .... .... .... = LG bit: Globally unique address (factory default)
        .... ...0 .... .... .... .... = IG bit: Individual address (unicast)
    Source: ASUSTekC_8f:dc:39 (04:d4:c4:8f:dc:39)
        Address: ASUSTekC_8f:dc:39 (04:d4:c4:8f:dc:39)
        .... ..0. .... .... .... .... = LG bit: Globally unique address (factory default)
        .... ...0 .... .... .... .... = IG bit: Individual address (unicast)
    Type: IPv4 (0x0800)
Internet Protocol Version 4, Src: 10.0.0.200, Dst: 10.0.0.100
    0100 .... = Version: 4
    .... 0101 = Header Length: 20 bytes (5)
    Differentiated Services Field: 0x00 (DSCP: CS0, ECN: Not-ECT)
    Total Length: 52
    Identification: 0xb26e (45678)
    Flags: 0x40, Don't fragment
    ...0 0000 0000 0000 = Fragment Offset: 0
    Time to Live: 128
    Protocol: TCP (6)
    Header Checksum: 0x0000 [validation disabled]
    [Header checksum status: Unverified]
    Source Address: 10.0.0.200
    Destination Address: 10.0.0.100
Transmission Control Protocol, Src Port: 49853, Dst Port: 502, Seq: 54, Ack: 13, Len: 12
Modbus/TCP
    Transaction Identifier: 2
    Protocol Identifier: 0
    Length: 6
    Unit Identifier: 1
Modbus
    .000 0011 = Function Code: Read Holding Registers (3)
    Reference Number: 23
    Word Count: 33
[Community ID: 1:PSBG9yJ0UQuB1PGFiuhe+YtZcTA=]

No.     Time           Source                Destination           Protocol Length Info
     97 17.106538      10.0.0.100            10.0.0.200            Modbus/TCP 129    Response: Trans:     2; Unit:   1, Func:   3: Read Holding Registers

Frame 97: 129 bytes on wire (1032 bits), 129 bytes captured (1032 bits) on interface \Device\NPF_{EFB199C7-A164-4748-BBF5-7ACCADB51238}, id 0
    Interface id: 0 (\Device\NPF_{EFB199C7-A164-4748-BBF5-7ACCADB51238})
    Encapsulation type: Ethernet (1)
    Arrival Time: Aug 16, 2022 17:35:48.806236000 Malay Peninsula Standard Time
    [Time shift for this packet: 0.000000000 seconds]
    Epoch Time: 1660642548.806236000 seconds
    [Time delta from previous captured frame: 0.109530000 seconds]
    [Time delta from previous displayed frame: 0.120986000 seconds]
    [Time since reference or first frame: 17.106538000 seconds]
    Frame Number: 97
    Frame Length: 129 bytes (1032 bits)
    Capture Length: 129 bytes (1032 bits)
    [Frame is marked: False]
    [Frame is ignored: False]
    [Protocols in frame: eth:ethertype:ip:tcp:mbtcp:modbus]
    [Coloring Rule Name: TCP]
    [Coloring Rule String: tcp]
Ethernet II, Src: Lantroni_da:27:10 (00:80:a3:da:27:10), Dst: ASUSTekC_8f:dc:39 (04:d4:c4:8f:dc:39)
    Destination: ASUSTekC_8f:dc:39 (04:d4:c4:8f:dc:39)
        Address: ASUSTekC_8f:dc:39 (04:d4:c4:8f:dc:39)
        .... ..0. .... .... .... .... = LG bit: Globally unique address (factory default)
        .... ...0 .... .... .... .... = IG bit: Individual address (unicast)
    Source: Lantroni_da:27:10 (00:80:a3:da:27:10)
        Address: Lantroni_da:27:10 (00:80:a3:da:27:10)
        .... ..0. .... .... .... .... = LG bit: Globally unique address (factory default)
        .... ...0 .... .... .... .... = IG bit: Individual address (unicast)
    Type: IPv4 (0x0800)
Internet Protocol Version 4, Src: 10.0.0.100, Dst: 10.0.0.200
    0100 .... = Version: 4
    .... 0101 = Header Length: 20 bytes (5)
    Differentiated Services Field: 0x00 (DSCP: CS0, ECN: Not-ECT)
    Total Length: 115
    Identification: 0xaaaf (43695)
    Flags: 0x40, Don't fragment
    ...0 0000 0000 0000 = Fragment Offset: 0
    Time to Live: 64
    Protocol: TCP (6)
    Header Checksum: 0x7aaa [validation disabled]
    [Header checksum status: Unverified]
    Source Address: 10.0.0.100
    Destination Address: 10.0.0.200
Transmission Control Protocol, Src Port: 502, Dst Port: 49853, Seq: 13, Ack: 66, Len: 75
Modbus/TCP
    Transaction Identifier: 2
    Protocol Identifier: 0
    Length: 69
    Unit Identifier: 1
Modbus
    .000 0011 = Function Code: Read Holding Registers (3)
    [Request Frame: 95]
    [Time from request: 0.120986000 seconds]
    Byte Count: 66
    Register 23 (UINT16): 10828
    Register 24 (UINT16): 493
    Register 25 (UINT16): 1070
    Register 26 (UINT16): 0
    Register 27 (UINT16): 1070
    Register 28 (UINT16): 3
    Register 29 (UINT16): 0
    Register 30 (UINT16): 1073
    Register 31 (UINT16): 3
    Register 32 (UINT16): 0
    Register 33 (UINT16): 1073
    Register 34 (UINT16): 3
    Register 35 (UINT16): 0
    Register 36 (UINT16): 1072
    Register 37 (UINT16): 3
    Register 38 (UINT16): 0
    Register 39 (UINT16): 1076
    Register 40 (UINT16): 3
    Register 41 (UINT16): 0
    Register 42 (UINT16): 1071
    Register 43 (UINT16): 3
    Register 44 (UINT16): 0
    Register 45 (UINT16): 1064
    Register 46 (UINT16): 3
    Register 47 (UINT16): 0
    Register 48 (UINT16): 1072
    Register 49 (UINT16): 3
    Register 50 (UINT16): 0
    Register 51 (UINT16): 1076
    Register 52 (UINT16): 3
    Register 53 (UINT16): 0
    Register 54 (UINT16): 1069
    Register 55 (UINT16): 3
[Community ID: 1:PSBG9yJ0UQuB1PGFiuhe+YtZcTA=]

No.     Time           Source                Destination           Protocol Length Info
     98 17.117608      10.0.0.200            10.0.0.100            Modbus/TCP 66        Query: Trans:     3; Unit:   1, Func:   3: Read Holding Registers

Frame 98: 66 bytes on wire (528 bits), 66 bytes captured (528 bits) on interface \Device\NPF_{EFB199C7-A164-4748-BBF5-7ACCADB51238}, id 0
    Interface id: 0 (\Device\NPF_{EFB199C7-A164-4748-BBF5-7ACCADB51238})
    Encapsulation type: Ethernet (1)
    Arrival Time: Aug 16, 2022 17:35:48.817306000 Malay Peninsula Standard Time
    [Time shift for this packet: 0.000000000 seconds]
    Epoch Time: 1660642548.817306000 seconds
    [Time delta from previous captured frame: 0.011070000 seconds]
    [Time delta from previous displayed frame: 0.011070000 seconds]
    [Time since reference or first frame: 17.117608000 seconds]
    Frame Number: 98
    Frame Length: 66 bytes (528 bits)
    Capture Length: 66 bytes (528 bits)
    [Frame is marked: False]
    [Frame is ignored: False]
    [Protocols in frame: eth:ethertype:ip:tcp:mbtcp:modbus]
    [Coloring Rule Name: TCP]
    [Coloring Rule String: tcp]
Ethernet II, Src: ASUSTekC_8f:dc:39 (04:d4:c4:8f:dc:39), Dst: Lantroni_da:27:10 (00:80:a3:da:27:10)
    Destination: Lantroni_da:27:10 (00:80:a3:da:27:10)
        Address: Lantroni_da:27:10 (00:80:a3:da:27:10)
        .... ..0. .... .... .... .... = LG bit: Globally unique address (factory default)
        .... ...0 .... .... .... .... = IG bit: Individual address (unicast)
    Source: ASUSTekC_8f:dc:39 (04:d4:c4:8f:dc:39)
        Address: ASUSTekC_8f:dc:39 (04:d4:c4:8f:dc:39)
        .... ..0. .... .... .... .... = LG bit: Globally unique address (factory default)
        .... ...0 .... .... .... .... = IG bit: Individual address (unicast)
    Type: IPv4 (0x0800)
Internet Protocol Version 4, Src: 10.0.0.200, Dst: 10.0.0.100
    0100 .... = Version: 4
    .... 0101 = Header Length: 20 bytes (5)
    Differentiated Services Field: 0x00 (DSCP: CS0, ECN: Not-ECT)
    Total Length: 52
    Identification: 0xb26f (45679)
    Flags: 0x40, Don't fragment
    ...0 0000 0000 0000 = Fragment Offset: 0
    Time to Live: 128
    Protocol: TCP (6)
    Header Checksum: 0x0000 [validation disabled]
    [Header checksum status: Unverified]
    Source Address: 10.0.0.200
    Destination Address: 10.0.0.100
Transmission Control Protocol, Src Port: 49853, Dst Port: 502, Seq: 66, Ack: 88, Len: 12
Modbus/TCP
    Transaction Identifier: 3
    Protocol Identifier: 0
    Length: 6
    Unit Identifier: 1
Modbus
    .000 0011 = Function Code: Read Holding Registers (3)
    Reference Number: 56
    Word Count: 20
[Community ID: 1:PSBG9yJ0UQuB1PGFiuhe+YtZcTA=]

No.     Time           Source                Destination           Protocol Length Info
    100 17.231089      10.0.0.100            10.0.0.200            Modbus/TCP 103    Response: Trans:     3; Unit:   1, Func:   3: Read Holding Registers

Frame 100: 103 bytes on wire (824 bits), 103 bytes captured (824 bits) on interface \Device\NPF_{EFB199C7-A164-4748-BBF5-7ACCADB51238}, id 0
    Interface id: 0 (\Device\NPF_{EFB199C7-A164-4748-BBF5-7ACCADB51238})
    Encapsulation type: Ethernet (1)
    Arrival Time: Aug 16, 2022 17:35:48.930787000 Malay Peninsula Standard Time
    [Time shift for this packet: 0.000000000 seconds]
    Epoch Time: 1660642548.930787000 seconds
    [Time delta from previous captured frame: 0.102044000 seconds]
    [Time delta from previous displayed frame: 0.113481000 seconds]
    [Time since reference or first frame: 17.231089000 seconds]
    Frame Number: 100
    Frame Length: 103 bytes (824 bits)
    Capture Length: 103 bytes (824 bits)
    [Frame is marked: False]
    [Frame is ignored: False]
    [Protocols in frame: eth:ethertype:ip:tcp:mbtcp:modbus]
    [Coloring Rule Name: TCP]
    [Coloring Rule String: tcp]
Ethernet II, Src: Lantroni_da:27:10 (00:80:a3:da:27:10), Dst: ASUSTekC_8f:dc:39 (04:d4:c4:8f:dc:39)
    Destination: ASUSTekC_8f:dc:39 (04:d4:c4:8f:dc:39)
        Address: ASUSTekC_8f:dc:39 (04:d4:c4:8f:dc:39)
        .... ..0. .... .... .... .... = LG bit: Globally unique address (factory default)
        .... ...0 .... .... .... .... = IG bit: Individual address (unicast)
    Source: Lantroni_da:27:10 (00:80:a3:da:27:10)
        Address: Lantroni_da:27:10 (00:80:a3:da:27:10)
        .... ..0. .... .... .... .... = LG bit: Globally unique address (factory default)
        .... ...0 .... .... .... .... = IG bit: Individual address (unicast)
    Type: IPv4 (0x0800)
Internet Protocol Version 4, Src: 10.0.0.100, Dst: 10.0.0.200
    0100 .... = Version: 4
    .... 0101 = Header Length: 20 bytes (5)
    Differentiated Services Field: 0x00 (DSCP: CS0, ECN: Not-ECT)
    Total Length: 89
    Identification: 0xaab1 (43697)
    Flags: 0x40, Don't fragment
    ...0 0000 0000 0000 = Fragment Offset: 0
    Time to Live: 64
    Protocol: TCP (6)
    Header Checksum: 0x7ac2 [validation disabled]
    [Header checksum status: Unverified]
    Source Address: 10.0.0.100
    Destination Address: 10.0.0.200
Transmission Control Protocol, Src Port: 502, Dst Port: 49853, Seq: 88, Ack: 78, Len: 49
Modbus/TCP
    Transaction Identifier: 3
    Protocol Identifier: 0
    Length: 43
    Unit Identifier: 1
Modbus
    .000 0011 = Function Code: Read Holding Registers (3)
    [Request Frame: 98]
    [Time from request: 0.113481000 seconds]
    Byte Count: 40
    Register 56 (UINT16): 0
    Register 57 (UINT16): 0
    Register 58 (UINT16): 0
    Register 59 (UINT16): 0
    Register 60 (UINT16): 0
    Register 61 (UINT16): 0
    Register 62 (UINT16): 0
    Register 63 (UINT16): 0
    Register 64 (UINT16): 0
    Register 65 (UINT16): 0
    Register 66 (UINT16): 0
    Register 67 (UINT16): 0
    Register 68 (UINT16): 0
    Register 69 (UINT16): 0
    Register 70 (UINT16): 0
    Register 71 (UINT16): 0
    Register 72 (UINT16): 0
    Register 73 (UINT16): 0
    Register 74 (UINT16): 0
    Register 75 (UINT16): 0
[Community ID: 1:PSBG9yJ0UQuB1PGFiuhe+YtZcTA=]

No.     Time           Source                Destination           Protocol Length Info
    101 17.235941      10.0.0.200            10.0.0.100            Modbus/TCP 66        Query: Trans:     4; Unit:   1, Func:   3: Read Holding Registers

Frame 101: 66 bytes on wire (528 bits), 66 bytes captured (528 bits) on interface \Device\NPF_{EFB199C7-A164-4748-BBF5-7ACCADB51238}, id 0
    Interface id: 0 (\Device\NPF_{EFB199C7-A164-4748-BBF5-7ACCADB51238})
    Encapsulation type: Ethernet (1)
    Arrival Time: Aug 16, 2022 17:35:48.935639000 Malay Peninsula Standard Time
    [Time shift for this packet: 0.000000000 seconds]
    Epoch Time: 1660642548.935639000 seconds
    [Time delta from previous captured frame: 0.004852000 seconds]
    [Time delta from previous displayed frame: 0.004852000 seconds]
    [Time since reference or first frame: 17.235941000 seconds]
    Frame Number: 101
    Frame Length: 66 bytes (528 bits)
    Capture Length: 66 bytes (528 bits)
    [Frame is marked: False]
    [Frame is ignored: False]
    [Protocols in frame: eth:ethertype:ip:tcp:mbtcp:modbus]
    [Coloring Rule Name: TCP]
    [Coloring Rule String: tcp]
Ethernet II, Src: ASUSTekC_8f:dc:39 (04:d4:c4:8f:dc:39), Dst: Lantroni_da:27:10 (00:80:a3:da:27:10)
    Destination: Lantroni_da:27:10 (00:80:a3:da:27:10)
        Address: Lantroni_da:27:10 (00:80:a3:da:27:10)
        .... ..0. .... .... .... .... = LG bit: Globally unique address (factory default)
        .... ...0 .... .... .... .... = IG bit: Individual address (unicast)
    Source: ASUSTekC_8f:dc:39 (04:d4:c4:8f:dc:39)
        Address: ASUSTekC_8f:dc:39 (04:d4:c4:8f:dc:39)
        .... ..0. .... .... .... .... = LG bit: Globally unique address (factory default)
        .... ...0 .... .... .... .... = IG bit: Individual address (unicast)
    Type: IPv4 (0x0800)
Internet Protocol Version 4, Src: 10.0.0.200, Dst: 10.0.0.100
    0100 .... = Version: 4
    .... 0101 = Header Length: 20 bytes (5)
    Differentiated Services Field: 0x00 (DSCP: CS0, ECN: Not-ECT)
    Total Length: 52
    Identification: 0xb270 (45680)
    Flags: 0x40, Don't fragment
    ...0 0000 0000 0000 = Fragment Offset: 0
    Time to Live: 128
    Protocol: TCP (6)
    Header Checksum: 0x0000 [validation disabled]
    [Header checksum status: Unverified]
    Source Address: 10.0.0.200
    Destination Address: 10.0.0.100
Transmission Control Protocol, Src Port: 49853, Dst Port: 502, Seq: 78, Ack: 137, Len: 12
Modbus/TCP
    Transaction Identifier: 4
    Protocol Identifier: 0
    Length: 6
    Unit Identifier: 1
Modbus
    .000 0011 = Function Code: Read Holding Registers (3)
    Reference Number: 0
    Word Count: 13
[Community ID: 1:PSBG9yJ0UQuB1PGFiuhe+YtZcTA=]

No.     Time           Source                Destination           Protocol Length Info
    103 17.354514      10.0.0.100            10.0.0.200            Modbus/TCP 89     Response: Trans:     4; Unit:   1, Func:   3: Read Holding Registers

Frame 103: 89 bytes on wire (712 bits), 89 bytes captured (712 bits) on interface \Device\NPF_{EFB199C7-A164-4748-BBF5-7ACCADB51238}, id 0
    Interface id: 0 (\Device\NPF_{EFB199C7-A164-4748-BBF5-7ACCADB51238})
    Encapsulation type: Ethernet (1)
    Arrival Time: Aug 16, 2022 17:35:49.054212000 Malay Peninsula Standard Time
    [Time shift for this packet: 0.000000000 seconds]
    Epoch Time: 1660642549.054212000 seconds
    [Time delta from previous captured frame: 0.107489000 seconds]
    [Time delta from previous displayed frame: 0.118573000 seconds]
    [Time since reference or first frame: 17.354514000 seconds]
    Frame Number: 103
    Frame Length: 89 bytes (712 bits)
    Capture Length: 89 bytes (712 bits)
    [Frame is marked: False]
    [Frame is ignored: False]
    [Protocols in frame: eth:ethertype:ip:tcp:mbtcp:modbus]
    [Coloring Rule Name: TCP]
    [Coloring Rule String: tcp]
Ethernet II, Src: Lantroni_da:27:10 (00:80:a3:da:27:10), Dst: ASUSTekC_8f:dc:39 (04:d4:c4:8f:dc:39)
    Destination: ASUSTekC_8f:dc:39 (04:d4:c4:8f:dc:39)
        Address: ASUSTekC_8f:dc:39 (04:d4:c4:8f:dc:39)
        .... ..0. .... .... .... .... = LG bit: Globally unique address (factory default)
        .... ...0 .... .... .... .... = IG bit: Individual address (unicast)
    Source: Lantroni_da:27:10 (00:80:a3:da:27:10)
        Address: Lantroni_da:27:10 (00:80:a3:da:27:10)
        .... ..0. .... .... .... .... = LG bit: Globally unique address (factory default)
        .... ...0 .... .... .... .... = IG bit: Individual address (unicast)
    Type: IPv4 (0x0800)
Internet Protocol Version 4, Src: 10.0.0.100, Dst: 10.0.0.200
    0100 .... = Version: 4
    .... 0101 = Header Length: 20 bytes (5)
    Differentiated Services Field: 0x00 (DSCP: CS0, ECN: Not-ECT)
    Total Length: 75
    Identification: 0xaab3 (43699)
    Flags: 0x40, Don't fragment
    ...0 0000 0000 0000 = Fragment Offset: 0
    Time to Live: 64
    Protocol: TCP (6)
    Header Checksum: 0x7ace [validation disabled]
    [Header checksum status: Unverified]
    Source Address: 10.0.0.100
    Destination Address: 10.0.0.200
Transmission Control Protocol, Src Port: 502, Dst Port: 49853, Seq: 137, Ack: 90, Len: 35
Modbus/TCP
    Transaction Identifier: 4
    Protocol Identifier: 0
    Length: 29
    Unit Identifier: 1
Modbus
    .000 0011 = Function Code: Read Holding Registers (3)
    [Request Frame: 101]
    [Time from request: 0.118573000 seconds]
    Byte Count: 26
    Register 0 (UINT16): 12601
    Register 1 (UINT16): 13109
    Register 2 (UINT16): 12337
    Register 3 (UINT16): 13877
    Register 4 (UINT16): 12592
    Register 5 (UINT16): 12851
    Register 6 (UINT16): 14132
    Register 7 (UINT16): 12592
    Register 8 (UINT16): 12851
    Register 9 (UINT16): 14132
    Register 10 (UINT16): 11568
    Register 11 (UINT16): 13101
    Register 12 (UINT16): 12336
[Community ID: 1:PSBG9yJ0UQuB1PGFiuhe+YtZcTA=]

No.     Time           Source                Destination           Protocol Length Info
    104 17.356504      10.0.0.200            10.0.0.100            Modbus/TCP 66        Query: Trans:     5; Unit:   1, Func:   3: Read Holding Registers

Frame 104: 66 bytes on wire (528 bits), 66 bytes captured (528 bits) on interface \Device\NPF_{EFB199C7-A164-4748-BBF5-7ACCADB51238}, id 0
    Interface id: 0 (\Device\NPF_{EFB199C7-A164-4748-BBF5-7ACCADB51238})
    Encapsulation type: Ethernet (1)
    Arrival Time: Aug 16, 2022 17:35:49.056202000 Malay Peninsula Standard Time
    [Time shift for this packet: 0.000000000 seconds]
    Epoch Time: 1660642549.056202000 seconds
    [Time delta from previous captured frame: 0.001990000 seconds]
    [Time delta from previous displayed frame: 0.001990000 seconds]
    [Time since reference or first frame: 17.356504000 seconds]
    Frame Number: 104
    Frame Length: 66 bytes (528 bits)
    Capture Length: 66 bytes (528 bits)
    [Frame is marked: False]
    [Frame is ignored: False]
    [Protocols in frame: eth:ethertype:ip:tcp:mbtcp:modbus]
    [Coloring Rule Name: TCP]
    [Coloring Rule String: tcp]
Ethernet II, Src: ASUSTekC_8f:dc:39 (04:d4:c4:8f:dc:39), Dst: Lantroni_da:27:10 (00:80:a3:da:27:10)
    Destination: Lantroni_da:27:10 (00:80:a3:da:27:10)
        Address: Lantroni_da:27:10 (00:80:a3:da:27:10)
        .... ..0. .... .... .... .... = LG bit: Globally unique address (factory default)
        .... ...0 .... .... .... .... = IG bit: Individual address (unicast)
    Source: ASUSTekC_8f:dc:39 (04:d4:c4:8f:dc:39)
        Address: ASUSTekC_8f:dc:39 (04:d4:c4:8f:dc:39)
        .... ..0. .... .... .... .... = LG bit: Globally unique address (factory default)
        .... ...0 .... .... .... .... = IG bit: Individual address (unicast)
    Type: IPv4 (0x0800)
Internet Protocol Version 4, Src: 10.0.0.200, Dst: 10.0.0.100
    0100 .... = Version: 4
    .... 0101 = Header Length: 20 bytes (5)
    Differentiated Services Field: 0x00 (DSCP: CS0, ECN: Not-ECT)
    Total Length: 52
    Identification: 0xb271 (45681)
    Flags: 0x40, Don't fragment
    ...0 0000 0000 0000 = Fragment Offset: 0
    Time to Live: 128
    Protocol: TCP (6)
    Header Checksum: 0x0000 [validation disabled]
    [Header checksum status: Unverified]
    Source Address: 10.0.0.200
    Destination Address: 10.0.0.100
Transmission Control Protocol, Src Port: 49853, Dst Port: 502, Seq: 90, Ack: 172, Len: 12
Modbus/TCP
    Transaction Identifier: 5
    Protocol Identifier: 0
    Length: 6
    Unit Identifier: 1
Modbus
    .000 0011 = Function Code: Read Holding Registers (3)
    Reference Number: 101
    Word Count: 25
[Community ID: 1:PSBG9yJ0UQuB1PGFiuhe+YtZcTA=]

No.     Time           Source                Destination           Protocol Length Info
    107 17.481799      10.0.0.100            10.0.0.200            Modbus/TCP 113    Response: Trans:     5; Unit:   1, Func:   3: Read Holding Registers

Frame 107: 113 bytes on wire (904 bits), 113 bytes captured (904 bits) on interface \Device\NPF_{EFB199C7-A164-4748-BBF5-7ACCADB51238}, id 0
    Interface id: 0 (\Device\NPF_{EFB199C7-A164-4748-BBF5-7ACCADB51238})
    Encapsulation type: Ethernet (1)
    Arrival Time: Aug 16, 2022 17:35:49.181497000 Malay Peninsula Standard Time
    [Time shift for this packet: 0.000000000 seconds]
    Epoch Time: 1660642549.181497000 seconds
    [Time delta from previous captured frame: 0.011346000 seconds]
    [Time delta from previous displayed frame: 0.125295000 seconds]
    [Time since reference or first frame: 17.481799000 seconds]
    Frame Number: 107
    Frame Length: 113 bytes (904 bits)
    Capture Length: 113 bytes (904 bits)
    [Frame is marked: False]
    [Frame is ignored: False]
    [Protocols in frame: eth:ethertype:ip:tcp:mbtcp:modbus]
    [Coloring Rule Name: TCP]
    [Coloring Rule String: tcp]
Ethernet II, Src: Lantroni_da:27:10 (00:80:a3:da:27:10), Dst: ASUSTekC_8f:dc:39 (04:d4:c4:8f:dc:39)
    Destination: ASUSTekC_8f:dc:39 (04:d4:c4:8f:dc:39)
        Address: ASUSTekC_8f:dc:39 (04:d4:c4:8f:dc:39)
        .... ..0. .... .... .... .... = LG bit: Globally unique address (factory default)
        .... ...0 .... .... .... .... = IG bit: Individual address (unicast)
    Source: Lantroni_da:27:10 (00:80:a3:da:27:10)
        Address: Lantroni_da:27:10 (00:80:a3:da:27:10)
        .... ..0. .... .... .... .... = LG bit: Globally unique address (factory default)
        .... ...0 .... .... .... .... = IG bit: Individual address (unicast)
    Type: IPv4 (0x0800)
Internet Protocol Version 4, Src: 10.0.0.100, Dst: 10.0.0.200
    0100 .... = Version: 4
    .... 0101 = Header Length: 20 bytes (5)
    Differentiated Services Field: 0x00 (DSCP: CS0, ECN: Not-ECT)
    Total Length: 99
    Identification: 0xaab5 (43701)
    Flags: 0x40, Don't fragment
    ...0 0000 0000 0000 = Fragment Offset: 0
    Time to Live: 64
    Protocol: TCP (6)
    Header Checksum: 0x7ab4 [validation disabled]
    [Header checksum status: Unverified]
    Source Address: 10.0.0.100
    Destination Address: 10.0.0.200
Transmission Control Protocol, Src Port: 502, Dst Port: 49853, Seq: 172, Ack: 102, Len: 59
Modbus/TCP
    Transaction Identifier: 5
    Protocol Identifier: 0
    Length: 53
    Unit Identifier: 1
Modbus
    .000 0011 = Function Code: Read Holding Registers (3)
    [Request Frame: 104]
    [Time from request: 0.125295000 seconds]
    Byte Count: 50
    Register 101 (UINT16): 64136
    Register 102 (UINT16): 1505
    Register 103 (UINT16): 44843
    Register 104 (UINT16): 44843
    Register 105 (UINT16): 44843
    Register 106 (UINT16): 44843
    Register 107 (UINT16): 44843
    Register 108 (UINT16): 44843
    Register 109 (UINT16): 44843
    Register 110 (UINT16): 44843
    Register 111 (UINT16): 44843
    Register 112 (UINT16): 44843
    Register 113 (UINT16): 860
    Register 114 (UINT16): 1300
    Register 115 (UINT16): 13060
    Register 116 (UINT16): 13060
    Register 117 (UINT16): 13060
    Register 118 (UINT16): 13060
    Register 119 (UINT16): 13060
    Register 120 (UINT16): 13060
    Register 121 (UINT16): 13060
    Register 122 (UINT16): 13060
    Register 123 (UINT16): 13060
    Register 124 (UINT16): 13060
    Register 125 (UINT16): 256
[Community ID: 1:PSBG9yJ0UQuB1PGFiuhe+YtZcTA=]

No.     Time           Source                Destination           Protocol Length Info
    108 17.482158      10.0.0.200            10.0.0.100            Modbus/TCP 66        Query: Trans:     6; Unit:   1, Func:   3: Read Holding Registers

Frame 108: 66 bytes on wire (528 bits), 66 bytes captured (528 bits) on interface \Device\NPF_{EFB199C7-A164-4748-BBF5-7ACCADB51238}, id 0
    Interface id: 0 (\Device\NPF_{EFB199C7-A164-4748-BBF5-7ACCADB51238})
    Encapsulation type: Ethernet (1)
    Arrival Time: Aug 16, 2022 17:35:49.181856000 Malay Peninsula Standard Time
    [Time shift for this packet: 0.000000000 seconds]
    Epoch Time: 1660642549.181856000 seconds
    [Time delta from previous captured frame: 0.000359000 seconds]
    [Time delta from previous displayed frame: 0.000359000 seconds]
    [Time since reference or first frame: 17.482158000 seconds]
    Frame Number: 108
    Frame Length: 66 bytes (528 bits)
    Capture Length: 66 bytes (528 bits)
    [Frame is marked: False]
    [Frame is ignored: False]
    [Protocols in frame: eth:ethertype:ip:tcp:mbtcp:modbus]
    [Coloring Rule Name: TCP]
    [Coloring Rule String: tcp]
Ethernet II, Src: ASUSTekC_8f:dc:39 (04:d4:c4:8f:dc:39), Dst: Lantroni_da:27:10 (00:80:a3:da:27:10)
    Destination: Lantroni_da:27:10 (00:80:a3:da:27:10)
        Address: Lantroni_da:27:10 (00:80:a3:da:27:10)
        .... ..0. .... .... .... .... = LG bit: Globally unique address (factory default)
        .... ...0 .... .... .... .... = IG bit: Individual address (unicast)
    Source: ASUSTekC_8f:dc:39 (04:d4:c4:8f:dc:39)
        Address: ASUSTekC_8f:dc:39 (04:d4:c4:8f:dc:39)
        .... ..0. .... .... .... .... = LG bit: Globally unique address (factory default)
        .... ...0 .... .... .... .... = IG bit: Individual address (unicast)
    Type: IPv4 (0x0800)
Internet Protocol Version 4, Src: 10.0.0.200, Dst: 10.0.0.100
    0100 .... = Version: 4
    .... 0101 = Header Length: 20 bytes (5)
    Differentiated Services Field: 0x00 (DSCP: CS0, ECN: Not-ECT)
    Total Length: 52
    Identification: 0xb272 (45682)
    Flags: 0x40, Don't fragment
    ...0 0000 0000 0000 = Fragment Offset: 0
    Time to Live: 128
    Protocol: TCP (6)
    Header Checksum: 0x0000 [validation disabled]
    [Header checksum status: Unverified]
    Source Address: 10.0.0.200
    Destination Address: 10.0.0.100
Transmission Control Protocol, Src Port: 49853, Dst Port: 502, Seq: 102, Ack: 231, Len: 12
Modbus/TCP
    Transaction Identifier: 6
    Protocol Identifier: 0
    Length: 6
    Unit Identifier: 1
Modbus
    .000 0011 = Function Code: Read Holding Registers (3)
    Reference Number: 125
    Word Count: 1
[Community ID: 1:PSBG9yJ0UQuB1PGFiuhe+YtZcTA=]

No.     Time           Source                Destination           Protocol Length Info
    110 17.609847      10.0.0.100            10.0.0.200            Modbus/TCP 65     Response: Trans:     6; Unit:   1, Func:   3: Read Holding Registers

Frame 110: 65 bytes on wire (520 bits), 65 bytes captured (520 bits) on interface \Device\NPF_{EFB199C7-A164-4748-BBF5-7ACCADB51238}, id 0
    Interface id: 0 (\Device\NPF_{EFB199C7-A164-4748-BBF5-7ACCADB51238})
    Encapsulation type: Ethernet (1)
    Arrival Time: Aug 16, 2022 17:35:49.309545000 Malay Peninsula Standard Time
    [Time shift for this packet: 0.000000000 seconds]
    Epoch Time: 1660642549.309545000 seconds
    [Time delta from previous captured frame: 0.116872000 seconds]
    [Time delta from previous displayed frame: 0.127689000 seconds]
    [Time since reference or first frame: 17.609847000 seconds]
    Frame Number: 110
    Frame Length: 65 bytes (520 bits)
    Capture Length: 65 bytes (520 bits)
    [Frame is marked: False]
    [Frame is ignored: False]
    [Protocols in frame: eth:ethertype:ip:tcp:mbtcp:modbus]
    [Coloring Rule Name: TCP]
    [Coloring Rule String: tcp]
Ethernet II, Src: Lantroni_da:27:10 (00:80:a3:da:27:10), Dst: ASUSTekC_8f:dc:39 (04:d4:c4:8f:dc:39)
    Destination: ASUSTekC_8f:dc:39 (04:d4:c4:8f:dc:39)
        Address: ASUSTekC_8f:dc:39 (04:d4:c4:8f:dc:39)
        .... ..0. .... .... .... .... = LG bit: Globally unique address (factory default)
        .... ...0 .... .... .... .... = IG bit: Individual address (unicast)
    Source: Lantroni_da:27:10 (00:80:a3:da:27:10)
        Address: Lantroni_da:27:10 (00:80:a3:da:27:10)
        .... ..0. .... .... .... .... = LG bit: Globally unique address (factory default)
        .... ...0 .... .... .... .... = IG bit: Individual address (unicast)
    Type: IPv4 (0x0800)
Internet Protocol Version 4, Src: 10.0.0.100, Dst: 10.0.0.200
    0100 .... = Version: 4
    .... 0101 = Header Length: 20 bytes (5)
    Differentiated Services Field: 0x00 (DSCP: CS0, ECN: Not-ECT)
    Total Length: 51
    Identification: 0xaab7 (43703)
    Flags: 0x40, Don't fragment
    ...0 0000 0000 0000 = Fragment Offset: 0
    Time to Live: 64
    Protocol: TCP (6)
    Header Checksum: 0x7ae2 [validation disabled]
    [Header checksum status: Unverified]
    Source Address: 10.0.0.100
    Destination Address: 10.0.0.200
Transmission Control Protocol, Src Port: 502, Dst Port: 49853, Seq: 231, Ack: 114, Len: 11
Modbus/TCP
    Transaction Identifier: 6
    Protocol Identifier: 0
    Length: 5
    Unit Identifier: 1
Modbus
    .000 0011 = Function Code: Read Holding Registers (3)
    [Request Frame: 108]
    [Time from request: 0.127689000 seconds]
    Byte Count: 2
    Register 125 (UINT16): 1
[Community ID: 1:PSBG9yJ0UQuB1PGFiuhe+YtZcTA=]

No.     Time           Source                Destination           Protocol Length Info
    111 17.657294      10.0.0.200            10.0.0.100            Modbus/TCP 107       Query: Trans:     7; Unit:   1, Func:  16: Write Multiple Registers

Frame 111: 107 bytes on wire (856 bits), 107 bytes captured (856 bits) on interface \Device\NPF_{EFB199C7-A164-4748-BBF5-7ACCADB51238}, id 0
    Interface id: 0 (\Device\NPF_{EFB199C7-A164-4748-BBF5-7ACCADB51238})
    Encapsulation type: Ethernet (1)
    Arrival Time: Aug 16, 2022 17:35:49.356992000 Malay Peninsula Standard Time
    [Time shift for this packet: 0.000000000 seconds]
    Epoch Time: 1660642549.356992000 seconds
    [Time delta from previous captured frame: 0.047447000 seconds]
    [Time delta from previous displayed frame: 0.047447000 seconds]
    [Time since reference or first frame: 17.657294000 seconds]
    Frame Number: 111
    Frame Length: 107 bytes (856 bits)
    Capture Length: 107 bytes (856 bits)
    [Frame is marked: False]
    [Frame is ignored: False]
    [Protocols in frame: eth:ethertype:ip:tcp:mbtcp:modbus]
    [Coloring Rule Name: TCP]
    [Coloring Rule String: tcp]
Ethernet II, Src: ASUSTekC_8f:dc:39 (04:d4:c4:8f:dc:39), Dst: Lantroni_da:27:10 (00:80:a3:da:27:10)
    Destination: Lantroni_da:27:10 (00:80:a3:da:27:10)
        Address: Lantroni_da:27:10 (00:80:a3:da:27:10)
        .... ..0. .... .... .... .... = LG bit: Globally unique address (factory default)
        .... ...0 .... .... .... .... = IG bit: Individual address (unicast)
    Source: ASUSTekC_8f:dc:39 (04:d4:c4:8f:dc:39)
        Address: ASUSTekC_8f:dc:39 (04:d4:c4:8f:dc:39)
        .... ..0. .... .... .... .... = LG bit: Globally unique address (factory default)
        .... ...0 .... .... .... .... = IG bit: Individual address (unicast)
    Type: IPv4 (0x0800)
Internet Protocol Version 4, Src: 10.0.0.200, Dst: 10.0.0.100
    0100 .... = Version: 4
    .... 0101 = Header Length: 20 bytes (5)
    Differentiated Services Field: 0x00 (DSCP: CS0, ECN: Not-ECT)
    Total Length: 93
    Identification: 0xb273 (45683)
    Flags: 0x40, Don't fragment
    ...0 0000 0000 0000 = Fragment Offset: 0
    Time to Live: 128
    Protocol: TCP (6)
    Header Checksum: 0x0000 [validation disabled]
    [Header checksum status: Unverified]
    Source Address: 10.0.0.200
    Destination Address: 10.0.0.100
Transmission Control Protocol, Src Port: 49853, Dst Port: 502, Seq: 114, Ack: 242, Len: 53
Modbus/TCP
    Transaction Identifier: 7
    Protocol Identifier: 0
    Length: 47
    Unit Identifier: 1
Modbus
    .001 0000 = Function Code: Write Multiple Registers (16)
    Reference Number: 56
    Word Count: 20
    Byte Count: 40
    Register 56 (UINT16): 0
    Register 57 (UINT16): 0
    Register 58 (UINT16): 0
    Register 59 (UINT16): 0
    Register 60 (UINT16): 0
    Register 61 (UINT16): 0
    Register 62 (UINT16): 0
    Register 63 (UINT16): 0
    Register 64 (UINT16): 0
