No.     Time           Source                Destination           Protocol Length Info
     18 20.081242      10.0.0.200            10.0.0.100            Modbus/TCP 66        Query: Trans:     2; Unit:   0, Func:   3: Read Holding Registers

Frame 18: 66 bytes on wire (528 bits), 66 bytes captured (528 bits) on interface \Device\NPF_{EFB199C7-A164-4748-BBF5-7ACCADB51238}, id 0
    Interface id: 0 (\Device\NPF_{EFB199C7-A164-4748-BBF5-7ACCADB51238})
    Encapsulation type: Ethernet (1)
    Arrival Time: Aug 16, 2022 17:37:27.966010000 Malay Peninsula Standard Time
    [Time shift for this packet: 0.000000000 seconds]
    Epoch Time: 1660642647.966010000 seconds
    [Time delta from previous captured frame: 0.003141000 seconds]
    [Time delta from previous displayed frame: 0.000000000 seconds]
    [Time since reference or first frame: 20.081242000 seconds]
    Frame Number: 18
    Frame Length: 66 bytes (528 bits)
    Capture Length: 66 bytes (528 bits)
    [Frame is marked: False]
    [Frame is ignored: False]
    [Protocols in frame: eth:ethertype:ip:tcp:mbtcp:modbus]
    [Coloring Rule Name: TCP]
    [Coloring Rule String: tcp]
Ethernet II, Src: ASUSTekC_8f:dc:39 (04:d4:c4:8f:dc:39), Dst: Lantroni_da:27:10 (00:80:a3:da:27:10)
    Destination: Lantroni_da:27:10 (00:80:a3:da:27:10)
        Address: Lantroni_da:27:10 (00:80:a3:da:27:10)
        .... ..0. .... .... .... .... = LG bit: Globally unique address (factory default)
        .... ...0 .... .... .... .... = IG bit: Individual address (unicast)
    Source: ASUSTekC_8f:dc:39 (04:d4:c4:8f:dc:39)
        Address: ASUSTekC_8f:dc:39 (04:d4:c4:8f:dc:39)
        .... ..0. .... .... .... .... = LG bit: Globally unique address (factory default)
        .... ...0 .... .... .... .... = IG bit: Individual address (unicast)
    Type: IPv4 (0x0800)
Internet Protocol Version 4, Src: 10.0.0.200, Dst: 10.0.0.100
    0100 .... = Version: 4
    .... 0101 = Header Length: 20 bytes (5)
    Differentiated Services Field: 0x00 (DSCP: CS0, ECN: Not-ECT)
    Total Length: 52
    Identification: 0xb294 (45716)
    Flags: 0x40, Don't fragment
    ...0 0000 0000 0000 = Fragment Offset: 0
    Time to Live: 128
    Protocol: TCP (6)
    Header Checksum: 0x0000 [validation disabled]
    [Header checksum status: Unverified]
    Source Address: 10.0.0.200
    Destination Address: 10.0.0.100
Transmission Control Protocol, Src Port: 49863, Dst Port: 502, Seq: 1, Ack: 1, Len: 12
Modbus/TCP
    Transaction Identifier: 2
    Protocol Identifier: 0
    Length: 6
    Unit Identifier: 0
Modbus
    .000 0011 = Function Code: Read Holding Registers (3)
    Reference Number: 0
    Word Count: 23
[Community ID: 1:Sn8QBGRGdyuEs/mCE5khRYwl30Q=]

No.     Time           Source                Destination           Protocol Length Info
     20 20.206329      10.0.0.100            10.0.0.200            Modbus/TCP 109    Response: Trans:     2; Unit:   0, Func:   3: Read Holding Registers

Frame 20: 109 bytes on wire (872 bits), 109 bytes captured (872 bits) on interface \Device\NPF_{EFB199C7-A164-4748-BBF5-7ACCADB51238}, id 0
    Interface id: 0 (\Device\NPF_{EFB199C7-A164-4748-BBF5-7ACCADB51238})
    Encapsulation type: Ethernet (1)
    Arrival Time: Aug 16, 2022 17:37:28.091097000 Malay Peninsula Standard Time
    [Time shift for this packet: 0.000000000 seconds]
    Epoch Time: 1660642648.091097000 seconds
    [Time delta from previous captured frame: 0.114650000 seconds]
    [Time delta from previous displayed frame: 0.125087000 seconds]
    [Time since reference or first frame: 20.206329000 seconds]
    Frame Number: 20
    Frame Length: 109 bytes (872 bits)
    Capture Length: 109 bytes (872 bits)
    [Frame is marked: False]
    [Frame is ignored: False]
    [Protocols in frame: eth:ethertype:ip:tcp:mbtcp:modbus]
    [Coloring Rule Name: TCP]
    [Coloring Rule String: tcp]
Ethernet II, Src: Lantroni_da:27:10 (00:80:a3:da:27:10), Dst: ASUSTekC_8f:dc:39 (04:d4:c4:8f:dc:39)
    Destination: ASUSTekC_8f:dc:39 (04:d4:c4:8f:dc:39)
        Address: ASUSTekC_8f:dc:39 (04:d4:c4:8f:dc:39)
        .... ..0. .... .... .... .... = LG bit: Globally unique address (factory default)
        .... ...0 .... .... .... .... = IG bit: Individual address (unicast)
    Source: Lantroni_da:27:10 (00:80:a3:da:27:10)
        Address: Lantroni_da:27:10 (00:80:a3:da:27:10)
        .... ..0. .... .... .... .... = LG bit: Globally unique address (factory default)
        .... ...0 .... .... .... .... = IG bit: Individual address (unicast)
    Type: IPv4 (0x0800)
Internet Protocol Version 4, Src: 10.0.0.100, Dst: 10.0.0.200
    0100 .... = Version: 4
    .... 0101 = Header Length: 20 bytes (5)
    Differentiated Services Field: 0x00 (DSCP: CS0, ECN: Not-ECT)
    Total Length: 95
    Identification: 0xaaed (43757)
    Flags: 0x40, Don't fragment
    ...0 0000 0000 0000 = Fragment Offset: 0
    Time to Live: 64
    Protocol: TCP (6)
    Header Checksum: 0x7a80 [validation disabled]
    [Header checksum status: Unverified]
    Source Address: 10.0.0.100
    Destination Address: 10.0.0.200
Transmission Control Protocol, Src Port: 502, Dst Port: 49863, Seq: 1, Ack: 13, Len: 55
Modbus/TCP
    Transaction Identifier: 2
    Protocol Identifier: 0
    Length: 49
    Unit Identifier: 0
Modbus
    .000 0011 = Function Code: Read Holding Registers (3)
    [Request Frame: 18]
    [Time from request: 0.125087000 seconds]
    Byte Count: 46
    Register 0 (UINT16): 12601
    Register 1 (UINT16): 13109
    Register 2 (UINT16): 12337
    Register 3 (UINT16): 13877
    Register 4 (UINT16): 12592
    Register 5 (UINT16): 12851
    Register 6 (UINT16): 14132
    Register 7 (UINT16): 12592
    Register 8 (UINT16): 12851
    Register 9 (UINT16): 14132
    Register 10 (UINT16): 11568
    Register 11 (UINT16): 13101
    Register 12 (UINT16): 12336
    Register 13 (UINT16): 43690
    Register 14 (UINT16): 43690
    Register 15 (UINT16): 43690
    Register 16 (UINT16): 43690
    Register 17 (UINT16): 43690
    Register 18 (UINT16): 43690
    Register 19 (UINT16): 43690
    Register 20 (UINT16): 43690
    Register 21 (UINT16): 43690
    Register 22 (UINT16): 43690
[Community ID: 1:Sn8QBGRGdyuEs/mCE5khRYwl30Q=]

No.     Time           Source                Destination           Protocol Length Info
     21 20.231642      10.0.0.200            10.0.0.100            Modbus/TCP 66        Query: Trans:     3; Unit:   0, Func:   3: Read Holding Registers

Frame 21: 66 bytes on wire (528 bits), 66 bytes captured (528 bits) on interface \Device\NPF_{EFB199C7-A164-4748-BBF5-7ACCADB51238}, id 0
    Interface id: 0 (\Device\NPF_{EFB199C7-A164-4748-BBF5-7ACCADB51238})
    Encapsulation type: Ethernet (1)
    Arrival Time: Aug 16, 2022 17:37:28.116410000 Malay Peninsula Standard Time
    [Time shift for this packet: 0.000000000 seconds]
    Epoch Time: 1660642648.116410000 seconds
    [Time delta from previous captured frame: 0.025313000 seconds]
    [Time delta from previous displayed frame: 0.025313000 seconds]
    [Time since reference or first frame: 20.231642000 seconds]
    Frame Number: 21
    Frame Length: 66 bytes (528 bits)
    Capture Length: 66 bytes (528 bits)
    [Frame is marked: False]
    [Frame is ignored: False]
    [Protocols in frame: eth:ethertype:ip:tcp:mbtcp:modbus]
    [Coloring Rule Name: TCP]
    [Coloring Rule String: tcp]
Ethernet II, Src: ASUSTekC_8f:dc:39 (04:d4:c4:8f:dc:39), Dst: Lantroni_da:27:10 (00:80:a3:da:27:10)
    Destination: Lantroni_da:27:10 (00:80:a3:da:27:10)
        Address: Lantroni_da:27:10 (00:80:a3:da:27:10)
        .... ..0. .... .... .... .... = LG bit: Globally unique address (factory default)
        .... ...0 .... .... .... .... = IG bit: Individual address (unicast)
    Source: ASUSTekC_8f:dc:39 (04:d4:c4:8f:dc:39)
        Address: ASUSTekC_8f:dc:39 (04:d4:c4:8f:dc:39)
        .... ..0. .... .... .... .... = LG bit: Globally unique address (factory default)
        .... ...0 .... .... .... .... = IG bit: Individual address (unicast)
    Type: IPv4 (0x0800)
Internet Protocol Version 4, Src: 10.0.0.200, Dst: 10.0.0.100
    0100 .... = Version: 4
    .... 0101 = Header Length: 20 bytes (5)
    Differentiated Services Field: 0x00 (DSCP: CS0, ECN: Not-ECT)
    Total Length: 52
    Identification: 0xb295 (45717)
    Flags: 0x40, Don't fragment
    ...0 0000 0000 0000 = Fragment Offset: 0
    Time to Live: 128
    Protocol: TCP (6)
    Header Checksum: 0x0000 [validation disabled]
    [Header checksum status: Unverified]
    Source Address: 10.0.0.200
    Destination Address: 10.0.0.100
Transmission Control Protocol, Src Port: 49863, Dst Port: 502, Seq: 13, Ack: 56, Len: 12
Modbus/TCP
    Transaction Identifier: 3
    Protocol Identifier: 0
    Length: 6
    Unit Identifier: 0
Modbus
    .000 0011 = Function Code: Read Holding Registers (3)
    Reference Number: 23
    Word Count: 33
[Community ID: 1:Sn8QBGRGdyuEs/mCE5khRYwl30Q=]

No.     Time           Source                Destination           Protocol Length Info
     23 20.335065      10.0.0.100            10.0.0.200            Modbus/TCP 129    Response: Trans:     3; Unit:   0, Func:   3: Read Holding Registers

Frame 23: 129 bytes on wire (1032 bits), 129 bytes captured (1032 bits) on interface \Device\NPF_{EFB199C7-A164-4748-BBF5-7ACCADB51238}, id 0
    Interface id: 0 (\Device\NPF_{EFB199C7-A164-4748-BBF5-7ACCADB51238})
    Encapsulation type: Ethernet (1)
    Arrival Time: Aug 16, 2022 17:37:28.219833000 Malay Peninsula Standard Time
    [Time shift for this packet: 0.000000000 seconds]
    Epoch Time: 1660642648.219833000 seconds
    [Time delta from previous captured frame: 0.092359000 seconds]
    [Time delta from previous displayed frame: 0.103423000 seconds]
    [Time since reference or first frame: 20.335065000 seconds]
    Frame Number: 23
    Frame Length: 129 bytes (1032 bits)
    Capture Length: 129 bytes (1032 bits)
    [Frame is marked: False]
    [Frame is ignored: False]
    [Protocols in frame: eth:ethertype:ip:tcp:mbtcp:modbus]
    [Coloring Rule Name: TCP]
    [Coloring Rule String: tcp]
Ethernet II, Src: Lantroni_da:27:10 (00:80:a3:da:27:10), Dst: ASUSTekC_8f:dc:39 (04:d4:c4:8f:dc:39)
    Destination: ASUSTekC_8f:dc:39 (04:d4:c4:8f:dc:39)
        Address: ASUSTekC_8f:dc:39 (04:d4:c4:8f:dc:39)
        .... ..0. .... .... .... .... = LG bit: Globally unique address (factory default)
        .... ...0 .... .... .... .... = IG bit: Individual address (unicast)
    Source: Lantroni_da:27:10 (00:80:a3:da:27:10)
        Address: Lantroni_da:27:10 (00:80:a3:da:27:10)
        .... ..0. .... .... .... .... = LG bit: Globally unique address (factory default)
        .... ...0 .... .... .... .... = IG bit: Individual address (unicast)
    Type: IPv4 (0x0800)
Internet Protocol Version 4, Src: 10.0.0.100, Dst: 10.0.0.200
    0100 .... = Version: 4
    .... 0101 = Header Length: 20 bytes (5)
    Differentiated Services Field: 0x00 (DSCP: CS0, ECN: Not-ECT)
    Total Length: 115
    Identification: 0xaaef (43759)
    Flags: 0x40, Don't fragment
    ...0 0000 0000 0000 = Fragment Offset: 0
    Time to Live: 64
    Protocol: TCP (6)
    Header Checksum: 0x7a6a [validation disabled]
    [Header checksum status: Unverified]
    Source Address: 10.0.0.100
    Destination Address: 10.0.0.200
Transmission Control Protocol, Src Port: 502, Dst Port: 49863, Seq: 56, Ack: 25, Len: 75
Modbus/TCP
    Transaction Identifier: 3
    Protocol Identifier: 0
    Length: 69
    Unit Identifier: 0
Modbus
    .000 0011 = Function Code: Read Holding Registers (3)
    [Request Frame: 21]
    [Time from request: 0.103423000 seconds]
    Byte Count: 66
    Register 23 (UINT16): 10789
    Register 24 (UINT16): 473
    Register 25 (UINT16): 1094
    Register 26 (UINT16): 1070
    Register 27 (UINT16): 1070
    Register 28 (UINT16): 3
    Register 29 (UINT16): 1073
    Register 30 (UINT16): 1072
    Register 31 (UINT16): 3
    Register 32 (UINT16): 1074
    Register 33 (UINT16): 1073
    Register 34 (UINT16): 3
    Register 35 (UINT16): 0
    Register 36 (UINT16): 1073
    Register 37 (UINT16): 3
    Register 38 (UINT16): 1076
    Register 39 (UINT16): 1075
    Register 40 (UINT16): 3
    Register 41 (UINT16): 1072
    Register 42 (UINT16): 1072
    Register 43 (UINT16): 3
    Register 44 (UINT16): 1065
    Register 45 (UINT16): 1065
    Register 46 (UINT16): 3
    Register 47 (UINT16): 1071
    Register 48 (UINT16): 1072
    Register 49 (UINT16): 3
    Register 50 (UINT16): 1076
    Register 51 (UINT16): 1076
    Register 52 (UINT16): 3
    Register 53 (UINT16): 0
    Register 54 (UINT16): 1069
    Register 55 (UINT16): 3
[Community ID: 1:Sn8QBGRGdyuEs/mCE5khRYwl30Q=]

No.     Time           Source                Destination           Protocol Length Info
     24 20.341296      10.0.0.200            10.0.0.100            Modbus/TCP 66        Query: Trans:     4; Unit:   0, Func:   3: Read Holding Registers

Frame 24: 66 bytes on wire (528 bits), 66 bytes captured (528 bits) on interface \Device\NPF_{EFB199C7-A164-4748-BBF5-7ACCADB51238}, id 0
    Interface id: 0 (\Device\NPF_{EFB199C7-A164-4748-BBF5-7ACCADB51238})
    Encapsulation type: Ethernet (1)
    Arrival Time: Aug 16, 2022 17:37:28.226064000 Malay Peninsula Standard Time
    [Time shift for this packet: 0.000000000 seconds]
    Epoch Time: 1660642648.226064000 seconds
    [Time delta from previous captured frame: 0.006231000 seconds]
    [Time delta from previous displayed frame: 0.006231000 seconds]
    [Time since reference or first frame: 20.341296000 seconds]
    Frame Number: 24
    Frame Length: 66 bytes (528 bits)
    Capture Length: 66 bytes (528 bits)
    [Frame is marked: False]
    [Frame is ignored: False]
    [Protocols in frame: eth:ethertype:ip:tcp:mbtcp:modbus]
    [Coloring Rule Name: TCP]
    [Coloring Rule String: tcp]
Ethernet II, Src: ASUSTekC_8f:dc:39 (04:d4:c4:8f:dc:39), Dst: Lantroni_da:27:10 (00:80:a3:da:27:10)
    Destination: Lantroni_da:27:10 (00:80:a3:da:27:10)
        Address: Lantroni_da:27:10 (00:80:a3:da:27:10)
        .... ..0. .... .... .... .... = LG bit: Globally unique address (factory default)
        .... ...0 .... .... .... .... = IG bit: Individual address (unicast)
    Source: ASUSTekC_8f:dc:39 (04:d4:c4:8f:dc:39)
        Address: ASUSTekC_8f:dc:39 (04:d4:c4:8f:dc:39)
        .... ..0. .... .... .... .... = LG bit: Globally unique address (factory default)
        .... ...0 .... .... .... .... = IG bit: Individual address (unicast)
    Type: IPv4 (0x0800)
Internet Protocol Version 4, Src: 10.0.0.200, Dst: 10.0.0.100
    0100 .... = Version: 4
    .... 0101 = Header Length: 20 bytes (5)
    Differentiated Services Field: 0x00 (DSCP: CS0, ECN: Not-ECT)
    Total Length: 52
    Identification: 0xb296 (45718)
    Flags: 0x40, Don't fragment
    ...0 0000 0000 0000 = Fragment Offset: 0
    Time to Live: 128
    Protocol: TCP (6)
    Header Checksum: 0x0000 [validation disabled]
    [Header checksum status: Unverified]
    Source Address: 10.0.0.200
    Destination Address: 10.0.0.100
Transmission Control Protocol, Src Port: 49863, Dst Port: 502, Seq: 25, Ack: 131, Len: 12
Modbus/TCP
    Transaction Identifier: 4
    Protocol Identifier: 0
    Length: 6
    Unit Identifier: 0
Modbus
    .000 0011 = Function Code: Read Holding Registers (3)
    Reference Number: 56
    Word Count: 87
[Community ID: 1:Sn8QBGRGdyuEs/mCE5khRYwl30Q=]

No.     Time           Source                Destination           Protocol Length Info
     26 20.475858      10.0.0.100            10.0.0.200            Modbus/TCP 237    Response: Trans:     4; Unit:   0, Func:   3: Read Holding Registers

Frame 26: 237 bytes on wire (1896 bits), 237 bytes captured (1896 bits) on interface \Device\NPF_{EFB199C7-A164-4748-BBF5-7ACCADB51238}, id 0
    Interface id: 0 (\Device\NPF_{EFB199C7-A164-4748-BBF5-7ACCADB51238})
    Encapsulation type: Ethernet (1)
    Arrival Time: Aug 16, 2022 17:37:28.360626000 Malay Peninsula Standard Time
    [Time shift for this packet: 0.000000000 seconds]
    Epoch Time: 1660642648.360626000 seconds
    [Time delta from previous captured frame: 0.123165000 seconds]
    [Time delta from previous displayed frame: 0.134562000 seconds]
    [Time since reference or first frame: 20.475858000 seconds]
    Frame Number: 26
    Frame Length: 237 bytes (1896 bits)
    Capture Length: 237 bytes (1896 bits)
    [Frame is marked: False]
    [Frame is ignored: False]
    [Protocols in frame: eth:ethertype:ip:tcp:mbtcp:modbus]
    [Coloring Rule Name: TCP]
    [Coloring Rule String: tcp]
Ethernet II, Src: Lantroni_da:27:10 (00:80:a3:da:27:10), Dst: ASUSTekC_8f:dc:39 (04:d4:c4:8f:dc:39)
    Destination: ASUSTekC_8f:dc:39 (04:d4:c4:8f:dc:39)
        Address: ASUSTekC_8f:dc:39 (04:d4:c4:8f:dc:39)
        .... ..0. .... .... .... .... = LG bit: Globally unique address (factory default)
        .... ...0 .... .... .... .... = IG bit: Individual address (unicast)
    Source: Lantroni_da:27:10 (00:80:a3:da:27:10)
        Address: Lantroni_da:27:10 (00:80:a3:da:27:10)
        .... ..0. .... .... .... .... = LG bit: Globally unique address (factory default)
        .... ...0 .... .... .... .... = IG bit: Individual address (unicast)
    Type: IPv4 (0x0800)
Internet Protocol Version 4, Src: 10.0.0.100, Dst: 10.0.0.200
    0100 .... = Version: 4
    .... 0101 = Header Length: 20 bytes (5)
    Differentiated Services Field: 0x00 (DSCP: CS0, ECN: Not-ECT)
    Total Length: 223
    Identification: 0xaaf1 (43761)
    Flags: 0x40, Don't fragment
    ...0 0000 0000 0000 = Fragment Offset: 0
    Time to Live: 64
    Protocol: TCP (6)
    Header Checksum: 0x79fc [validation disabled]
    [Header checksum status: Unverified]
    Source Address: 10.0.0.100
    Destination Address: 10.0.0.200
Transmission Control Protocol, Src Port: 502, Dst Port: 49863, Seq: 131, Ack: 37, Len: 183
Modbus/TCP
    Transaction Identifier: 4
    Protocol Identifier: 0
    Length: 177
    Unit Identifier: 0
Modbus
    .000 0011 = Function Code: Read Holding Registers (3)
    [Request Frame: 24]
    [Time from request: 0.134562000 seconds]
    Byte Count: 174
    Register 56 (UINT16): 0
    Register 57 (UINT16): 0
    Register 58 (UINT16): 0
    Register 59 (UINT16): 0
    Register 60 (UINT16): 0
    Register 61 (UINT16): 0
    Register 62 (UINT16): 0
    Register 63 (UINT16): 0
    Register 64 (UINT16): 0
    Register 65 (UINT16): 0
    Register 66 (UINT16): 0
    Register 67 (UINT16): 0
    Register 68 (UINT16): 0
    Register 69 (UINT16): 0
    Register 70 (UINT16): 0
    Register 71 (UINT16): 0
    Register 72 (UINT16): 0
    Register 73 (UINT16): 0
    Register 74 (UINT16): 0
    Register 75 (UINT16): 0
    Register 76 (UINT16): 0
    Register 77 (UINT16): 0
    Register 78 (UINT16): 0
    Register 79 (UINT16): 0
    Register 80 (UINT16): 0
    Register 81 (UINT16): 0
    Register 82 (UINT16): 0
    Register 83 (UINT16): 0
    Register 84 (UINT16): 0
    Register 85 (UINT16): 0
    Register 86 (UINT16): 0
    Register 87 (UINT16): 0
    Register 88 (UINT16): 0
    Register 89 (UINT16): 0
    Register 90 (UINT16): 0
    Register 91 (UINT16): 0
    Register 92 (UINT16): 0
    Register 93 (UINT16): 0
    Register 94 (UINT16): 0
    Register 95 (UINT16): 0
    Register 96 (UINT16): 0
    Register 97 (UINT16): 0
    Register 98 (UINT16): 0
    Register 99 (UINT16): 0
    Register 100 (UINT16): 0
    Register 101 (UINT16): 64136
    Register 102 (UINT16): 1505
    Register 103 (UINT16): 44843
    Register 104 (UINT16): 44843
    Register 105 (UINT16): 44843
    Register 106 (UINT16): 44843
    Register 107 (UINT16): 44843
    Register 108 (UINT16): 44843
    Register 109 (UINT16): 44843
    Register 110 (UINT16): 44843
    Register 111 (UINT16): 44843
    Register 112 (UINT16): 44843
    Register 113 (UINT16): 860
    Register 114 (UINT16): 1300
    Register 115 (UINT16): 13060
    Register 116 (UINT16): 13060
    Register 117 (UINT16): 13060
    Register 118 (UINT16): 13060
    Register 119 (UINT16): 13060
    Register 120 (UINT16): 13060
    Register 121 (UINT16): 13060
    Register 122 (UINT16): 13060
    Register 123 (UINT16): 13060
    Register 124 (UINT16): 13060
    Register 125 (UINT16): 256
    Register 126 (UINT16): 0
    Register 127 (UINT16): 0
    Register 128 (UINT16): 0
    Register 129 (UINT16): 0
    Register 130 (UINT16): 0
    Register 131 (UINT16): 0
    Register 132 (UINT16): 0
    Register 133 (UINT16): 0
    Register 134 (UINT16): 0
    Register 135 (UINT16): 0
    Register 136 (UINT16): 0
    Register 137 (UINT16): 0
    Register 138 (UINT16): 0
    Register 139 (UINT16): 0
    Register 140 (UINT16): 0
    Register 141 (UINT16): 0
    Register 142 (UINT16): 0
[Community ID: 1:Sn8QBGRGdyuEs/mCE5khRYwl30Q=]

No.     Time           Source                Destination           Protocol Length Info
     28 20.734309      10.0.0.200            10.0.0.100            Modbus/TCP 66        Query: Trans:     5; Unit:   0, Func:   3: Read Holding Registers

Frame 28: 66 bytes on wire (528 bits), 66 bytes captured (528 bits) on interface \Device\NPF_{EFB199C7-A164-4748-BBF5-7ACCADB51238}, id 0
    Interface id: 0 (\Device\NPF_{EFB199C7-A164-4748-BBF5-7ACCADB51238})
    Encapsulation type: Ethernet (1)
    Arrival Time: Aug 16, 2022 17:37:28.619077000 Malay Peninsula Standard Time
    [Time shift for this packet: 0.000000000 seconds]
    Epoch Time: 1660642648.619077000 seconds
    [Time delta from previous captured frame: 0.204540000 seconds]
    [Time delta from previous displayed frame: 0.258451000 seconds]
    [Time since reference or first frame: 20.734309000 seconds]
    Frame Number: 28
    Frame Length: 66 bytes (528 bits)
    Capture Length: 66 bytes (528 bits)
    [Frame is marked: False]
    [Frame is ignored: False]
    [Protocols in frame: eth:ethertype:ip:tcp:mbtcp:modbus]
    [Coloring Rule Name: TCP]
    [Coloring Rule String: tcp]
Ethernet II, Src: ASUSTekC_8f:dc:39 (04:d4:c4:8f:dc:39), Dst: Lantroni_da:27:10 (00:80:a3:da:27:10)
    Destination: Lantroni_da:27:10 (00:80:a3:da:27:10)
        Address: Lantroni_da:27:10 (00:80:a3:da:27:10)
        .... ..0. .... .... .... .... = LG bit: Globally unique address (factory default)
        .... ...0 .... .... .... .... = IG bit: Individual address (unicast)
    Source: ASUSTekC_8f:dc:39 (04:d4:c4:8f:dc:39)
        Address: ASUSTekC_8f:dc:39 (04:d4:c4:8f:dc:39)
        .... ..0. .... .... .... .... = LG bit: Globally unique address (factory default)
        .... ...0 .... .... .... .... = IG bit: Individual address (unicast)
    Type: IPv4 (0x0800)
Internet Protocol Version 4, Src: 10.0.0.200, Dst: 10.0.0.100
    0100 .... = Version: 4
    .... 0101 = Header Length: 20 bytes (5)
    Differentiated Services Field: 0x00 (DSCP: CS0, ECN: Not-ECT)
    Total Length: 52
    Identification: 0xb298 (45720)
    Flags: 0x40, Don't fragment
    ...0 0000 0000 0000 = Fragment Offset: 0
    Time to Live: 128
    Protocol: TCP (6)
    Header Checksum: 0x0000 [validation disabled]
    [Header checksum status: Unverified]
    Source Address: 10.0.0.200
    Destination Address: 10.0.0.100
Transmission Control Protocol, Src Port: 49863, Dst Port: 502, Seq: 37, Ack: 314, Len: 12
Modbus/TCP
    Transaction Identifier: 5
    Protocol Identifier: 0
    Length: 6
    Unit Identifier: 0
Modbus
    .000 0011 = Function Code: Read Holding Registers (3)
    Reference Number: 23
    Word Count: 33
[Community ID: 1:Sn8QBGRGdyuEs/mCE5khRYwl30Q=]

No.     Time           Source                Destination           Protocol Length Info
     30 20.844266      10.0.0.100            10.0.0.200            Modbus/TCP 129    Response: Trans:     5; Unit:   0, Func:   3: Read Holding Registers

Frame 30: 129 bytes on wire (1032 bits), 129 bytes captured (1032 bits) on interface \Device\NPF_{EFB199C7-A164-4748-BBF5-7ACCADB51238}, id 0
    Interface id: 0 (\Device\NPF_{EFB199C7-A164-4748-BBF5-7ACCADB51238})
    Encapsulation type: Ethernet (1)
    Arrival Time: Aug 16, 2022 17:37:28.729034000 Malay Peninsula Standard Time
    [Time shift for this packet: 0.000000000 seconds]
    Epoch Time: 1660642648.729034000 seconds
    [Time delta from previous captured frame: 0.098535000 seconds]
    [Time delta from previous displayed frame: 0.109957000 seconds]
    [Time since reference or first frame: 20.844266000 seconds]
    Frame Number: 30
    Frame Length: 129 bytes (1032 bits)
    Capture Length: 129 bytes (1032 bits)
    [Frame is marked: False]
    [Frame is ignored: False]
    [Protocols in frame: eth:ethertype:ip:tcp:mbtcp:modbus]
    [Coloring Rule Name: TCP]
    [Coloring Rule String: tcp]
Ethernet II, Src: Lantroni_da:27:10 (00:80:a3:da:27:10), Dst: ASUSTekC_8f:dc:39 (04:d4:c4:8f:dc:39)
    Destination: ASUSTekC_8f:dc:39 (04:d4:c4:8f:dc:39)
        Address: ASUSTekC_8f:dc:39 (04:d4:c4:8f:dc:39)
        .... ..0. .... .... .... .... = LG bit: Globally unique address (factory default)
        .... ...0 .... .... .... .... = IG bit: Individual address (unicast)
    Source: Lantroni_da:27:10 (00:80:a3:da:27:10)
        Address: Lantroni_da:27:10 (00:80:a3:da:27:10)
        .... ..0. .... .... .... .... = LG bit: Globally unique address (factory default)
        .... ...0 .... .... .... .... = IG bit: Individual address (unicast)
    Type: IPv4 (0x0800)
Internet Protocol Version 4, Src: 10.0.0.100, Dst: 10.0.0.200
    0100 .... = Version: 4
    .... 0101 = Header Length: 20 bytes (5)
    Differentiated Services Field: 0x00 (DSCP: CS0, ECN: Not-ECT)
    Total Length: 115
    Identification: 0xaaf3 (43763)
    Flags: 0x40, Don't fragment
    ...0 0000 0000 0000 = Fragment Offset: 0
    Time to Live: 64
    Protocol: TCP (6)
    Header Checksum: 0x7a66 [validation disabled]
    [Header checksum status: Unverified]
    Source Address: 10.0.0.100
    Destination Address: 10.0.0.200
Transmission Control Protocol, Src Port: 502, Dst Port: 49863, Seq: 314, Ack: 49, Len: 75
Modbus/TCP
    Transaction Identifier: 5
    Protocol Identifier: 0
    Length: 69
    Unit Identifier: 0
Modbus
    .000 0011 = Function Code: Read Holding Registers (3)
    [Request Frame: 28]
    [Time from request: 0.109957000 seconds]
    Byte Count: 66
    Register 23 (UINT16): 10790
    Register 24 (UINT16): 477
    Register 25 (UINT16): 1100
    Register 26 (UINT16): 1070
    Register 27 (UINT16): 1070
    Register 28 (UINT16): 3
    Register 29 (UINT16): 1073
    Register 30 (UINT16): 1073
    Register 31 (UINT16): 3
    Register 32 (UINT16): 1074
    Register 33 (UINT16): 1074
    Register 34 (UINT16): 3
    Register 35 (UINT16): 0
    Register 36 (UINT16): 1073
    Register 37 (UINT16): 3
    Register 38 (UINT16): 1076
    Register 39 (UINT16): 1077
    Register 40 (UINT16): 3
    Register 41 (UINT16): 1072
    Register 42 (UINT16): 1072
    Register 43 (UINT16): 3
    Register 44 (UINT16): 1065
    Register 45 (UINT16): 1064
    Register 46 (UINT16): 3
    Register 47 (UINT16): 1071
    Register 48 (UINT16): 1072
    Register 49 (UINT16): 3
    Register 50 (UINT16): 1076
    Register 51 (UINT16): 1076
    Register 52 (UINT16): 3
    Register 53 (UINT16): 0
    Register 54 (UINT16): 1069
    Register 55 (UINT16): 3
[Community ID: 1:Sn8QBGRGdyuEs/mCE5khRYwl30Q=]

No.     Time           Source                Destination           Protocol Length Info
     31 20.858793      10.0.0.200            10.0.0.100            Modbus/TCP 66        Query: Trans:     6; Unit:   0, Func:   3: Read Holding Registers

Frame 31: 66 bytes on wire (528 bits), 66 bytes captured (528 bits) on interface \Device\NPF_{EFB199C7-A164-4748-BBF5-7ACCADB51238}, id 0
    Interface id: 0 (\Device\NPF_{EFB199C7-A164-4748-BBF5-7ACCADB51238})
    Encapsulation type: Ethernet (1)
    Arrival Time: Aug 16, 2022 17:37:28.743561000 Malay Peninsula Standard Time
    [Time shift for this packet: 0.000000000 seconds]
    Epoch Time: 1660642648.743561000 seconds
    [Time delta from previous captured frame: 0.014527000 seconds]
    [Time delta from previous displayed frame: 0.014527000 seconds]
    [Time since reference or first frame: 20.858793000 seconds]
    Frame Number: 31
    Frame Length: 66 bytes (528 bits)
    Capture Length: 66 bytes (528 bits)
    [Frame is marked: False]
    [Frame is ignored: False]
    [Protocols in frame: eth:ethertype:ip:tcp:mbtcp:modbus]
    [Coloring Rule Name: TCP]
    [Coloring Rule String: tcp]
Ethernet II, Src: ASUSTekC_8f:dc:39 (04:d4:c4:8f:dc:39), Dst: Lantroni_da:27:10 (00:80:a3:da:27:10)
    Destination: Lantroni_da:27:10 (00:80:a3:da:27:10)
        Address: Lantroni_da:27:10 (00:80:a3:da:27:10)
        .... ..0. .... .... .... .... = LG bit: Globally unique address (factory default)
        .... ...0 .... .... .... .... = IG bit: Individual address (unicast)
    Source: ASUSTekC_8f:dc:39 (04:d4:c4:8f:dc:39)
        Address: ASUSTekC_8f:dc:39 (04:d4:c4:8f:dc:39)
        .... ..0. .... .... .... .... = LG bit: Globally unique address (factory default)
        .... ...0 .... .... .... .... = IG bit: Individual address (unicast)
    Type: IPv4 (0x0800)
Internet Protocol Version 4, Src: 10.0.0.200, Dst: 10.0.0.100
    0100 .... = Version: 4
    .... 0101 = Header Length: 20 bytes (5)
    Differentiated Services Field: 0x00 (DSCP: CS0, ECN: Not-ECT)
    Total Length: 52
    Identification: 0xb299 (45721)
    Flags: 0x40, Don't fragment
    ...0 0000 0000 0000 = Fragment Offset: 0
    Time to Live: 128
    Protocol: TCP (6)
    Header Checksum: 0x0000 [validation disabled]
    [Header checksum status: Unverified]
    Source Address: 10.0.0.200
    Destination Address: 10.0.0.100
Transmission Control Protocol, Src Port: 49863, Dst Port: 502, Seq: 49, Ack: 389, Len: 12
Modbus/TCP
    Transaction Identifier: 6
    Protocol Identifier: 0
    Length: 6
    Unit Identifier: 0
Modbus
    .000 0011 = Function Code: Read Holding Registers (3)
    Reference Number: 56
    Word Count: 87
[Community ID: 1:Sn8QBGRGdyuEs/mCE5khRYwl30Q=]

No.     Time           Source                Destination           Protocol Length Info
     33 20.983096      10.0.0.100            10.0.0.200            Modbus/TCP 237    Response: Trans:     6; Unit:   0, Func:   3: Read Holding Registers

Frame 33: 237 bytes on wire (1896 bits), 237 bytes captured (1896 bits) on interface \Device\NPF_{EFB199C7-A164-4748-BBF5-7ACCADB51238}, id 0
    Interface id: 0 (\Device\NPF_{EFB199C7-A164-4748-BBF5-7ACCADB51238})
    Encapsulation type: Ethernet (1)
    Arrival Time: Aug 16, 2022 17:37:28.867864000 Malay Peninsula Standard Time
    [Time shift for this packet: 0.000000000 seconds]
    Epoch Time: 1660642648.867864000 seconds
    [Time delta from previous captured frame: 0.113351000 seconds]
    [Time delta from previous displayed frame: 0.124303000 seconds]
    [Time since reference or first frame: 20.983096000 seconds]
    Frame Number: 33
    Frame Length: 237 bytes (1896 bits)
    Capture Length: 237 bytes (1896 bits)
    [Frame is marked: False]
    [Frame is ignored: False]
    [Protocols in frame: eth:ethertype:ip:tcp:mbtcp:modbus]
    [Coloring Rule Name: TCP]
    [Coloring Rule String: tcp]
Ethernet II, Src: Lantroni_da:27:10 (00:80:a3:da:27:10), Dst: ASUSTekC_8f:dc:39 (04:d4:c4:8f:dc:39)
    Destination: ASUSTekC_8f:dc:39 (04:d4:c4:8f:dc:39)
        Address: ASUSTekC_8f:dc:39 (04:d4:c4:8f:dc:39)
        .... ..0. .... .... .... .... = LG bit: Globally unique address (factory default)
        .... ...0 .... .... .... .... = IG bit: Individual address (unicast)
    Source: Lantroni_da:27:10 (00:80:a3:da:27:10)
        Address: Lantroni_da:27:10 (00:80:a3:da:27:10)
        .... ..0. .... .... .... .... = LG bit: Globally unique address (factory default)
        .... ...0 .... .... .... .... = IG bit: Individual address (unicast)
    Type: IPv4 (0x0800)
Internet Protocol Version 4, Src: 10.0.0.100, Dst: 10.0.0.200
    0100 .... = Version: 4
    .... 0101 = Header Length: 20 bytes (5)
    Differentiated Services Field: 0x00 (DSCP: CS0, ECN: Not-ECT)
    Total Length: 223
    Identification: 0xaaf5 (43765)
    Flags: 0x40, Don't fragment
    ...0 0000 0000 0000 = Fragment Offset: 0
    Time to Live: 64
    Protocol: TCP (6)
    Header Checksum: 0x79f8 [validation disabled]
    [Header checksum status: Unverified]
    Source Address: 10.0.0.100
    Destination Address: 10.0.0.200
Transmission Control Protocol, Src Port: 502, Dst Port: 49863, Seq: 389, Ack: 61, Len: 183
Modbus/TCP
    Transaction Identifier: 6
    Protocol Identifier: 0
    Length: 177
    Unit Identifier: 0
Modbus
    .000 0011 = Function Code: Read Holding Registers (3)
    [Request Frame: 31]
    [Time from request: 0.124303000 seconds]
    Byte Count: 174
    Register 56 (UINT16): 0
    Register 57 (UINT16): 0
    Register 58 (UINT16): 0
    Register 59 (UINT16): 0
    Register 60 (UINT16): 0
    Register 61 (UINT16): 0
    Register 62 (UINT16): 0
    Register 63 (UINT16): 0
    Register 64 (UINT16): 0
    Register 65 (UINT16): 0
    Register 66 (UINT16): 0
    Register 67 (UINT16): 0
    Register 68 (UINT16): 0
    Register 69 (UINT16): 0
    Register 70 (UINT16): 0
    Register 71 (UINT16): 0
    Register 72 (UINT16): 0
    Register 73 (UINT16): 0
    Register 74 (UINT16): 0
    Register 75 (UINT16): 0
    Register 76 (UINT16): 0
    Register 77 (UINT16): 0
    Register 78 (UINT16): 0
    Register 79 (UINT16): 0
    Register 80 (UINT16): 0
    Register 81 (UINT16): 0
    Register 82 (UINT16): 0
    Register 83 (UINT16): 0
    Register 84 (UINT16): 0
    Register 85 (UINT16): 0
    Register 86 (UINT16): 0
    Register 87 (UINT16): 0
    Register 88 (UINT16): 0
    Register 89 (UINT16): 0
    Register 90 (UINT16): 0
    Register 91 (UINT16): 0
    Register 92 (UINT16): 0
    Register 93 (UINT16): 0
    Register 94 (UINT16): 0
    Register 95 (UINT16): 0
    Register 96 (UINT16): 0
    Register 97 (UINT16): 0
    Register 98 (UINT16): 0
    Register 99 (UINT16): 0
    Register 100 (UINT16): 0
    Register 101 (UINT16): 64136
    Register 102 (UINT16): 1505
    Register 103 (UINT16): 44843
    Register 104 (UINT16): 44843
    Register 105 (UINT16): 44843
    Register 106 (UINT16): 44843
    Register 107 (UINT16): 44843
    Register 108 (UINT16): 44843
    Register 109 (UINT16): 44843
    Register 110 (UINT16): 44843
    Register 111 (UINT16): 44843
    Register 112 (UINT16): 44843
    Register 113 (UINT16): 860
    Register 114 (UINT16): 1300
    Register 115 (UINT16): 13060
    Register 116 (UINT16): 13060
    Register 117 (UINT16): 13060
    Register 118 (UINT16): 13060
    Register 119 (UINT16): 13060
    Register 120 (UINT16): 13060
    Register 121 (UINT16): 13060
    Register 122 (UINT16): 13060
    Register 123 (UINT16): 13060
    Register 124 (UINT16): 13060
    Register 125 (UINT16): 256
    Register 126 (UINT16): 0
    Register 127 (UINT16): 0
    Register 128 (UINT16): 0
    Register 129 (UINT16): 0
    Register 130 (UINT16): 0
    Register 131 (UINT16): 0
    Register 132 (UINT16): 0
    Register 133 (UINT16): 0
    Register 134 (UINT16): 0
    Register 135 (UINT16): 0
    Register 136 (UINT16): 0
    Register 137 (UINT16): 0
    Register 138 (UINT16): 0
    Register 139 (UINT16): 0
    Register 140 (UINT16): 0
    Register 141 (UINT16): 0
    Register 142 (UINT16): 0
[Community ID: 1:Sn8QBGRGdyuEs/mCE5khRYwl30Q=]

No.     Time           Source                Destination           Protocol Length Info
     37 21.247307      10.0.0.200            10.0.0.100            Modbus/TCP 66        Query: Trans:     7; Unit:   0, Func:   3: Read Holding Registers

Frame 37: 66 bytes on wire (528 bits), 66 bytes captured (528 bits) on interface \Device\NPF_{EFB199C7-A164-4748-BBF5-7ACCADB51238}, id 0
    Interface id: 0 (\Device\NPF_{EFB199C7-A164-4748-BBF5-7ACCADB51238})
    Encapsulation type: Ethernet (1)
    Arrival Time: Aug 16, 2022 17:37:29.132075000 Malay Peninsula Standard Time
    [Time shift for this packet: 0.000000000 seconds]
    Epoch Time: 1660642649.132075000 seconds
    [Time delta from previous captured frame: 0.061485000 seconds]
    [Time delta from previous displayed frame: 0.264211000 seconds]
    [Time since reference or first frame: 21.247307000 seconds]
    Frame Number: 37
    Frame Length: 66 bytes (528 bits)
    Capture Length: 66 bytes (528 bits)
    [Frame is marked: False]
    [Frame is ignored: False]
    [Protocols in frame: eth:ethertype:ip:tcp:mbtcp:modbus]
    [Coloring Rule Name: TCP]
    [Coloring Rule String: tcp]
Ethernet II, Src: ASUSTekC_8f:dc:39 (04:d4:c4:8f:dc:39), Dst: Lantroni_da:27:10 (00:80:a3:da:27:10)
    Destination: Lantroni_da:27:10 (00:80:a3:da:27:10)
        Address: Lantroni_da:27:10 (00:80:a3:da:27:10)
        .... ..0. .... .... .... .... = LG bit: Globally unique address (factory default)
        .... ...0 .... .... .... .... = IG bit: Individual address (unicast)
    Source: ASUSTekC_8f:dc:39 (04:d4:c4:8f:dc:39)
        Address: ASUSTekC_8f:dc:39 (04:d4:c4:8f:dc:39)
        .... ..0. .... .... .... .... = LG bit: Globally unique address (factory default)
        .... ...0 .... .... .... .... = IG bit: Individual address (unicast)
    Type: IPv4 (0x0800)
Internet Protocol Version 4, Src: 10.0.0.200, Dst: 10.0.0.100
    0100 .... = Version: 4
    .... 0101 = Header Length: 20 bytes (5)
    Differentiated Services Field: 0x00 (DSCP: CS0, ECN: Not-ECT)
    Total Length: 52
    Identification: 0xb29b (45723)
    Flags: 0x40, Don't fragment
    ...0 0000 0000 0000 = Fragment Offset: 0
    Time to Live: 128
    Protocol: TCP (6)
    Header Checksum: 0x0000 [validation disabled]
    [Header checksum status: Unverified]
    Source Address: 10.0.0.200
    Destination Address: 10.0.0.100
Transmission Control Protocol, Src Port: 49863, Dst Port: 502, Seq: 61, Ack: 572, Len: 12
Modbus/TCP
    Transaction Identifier: 7
    Protocol Identifier: 0
    Length: 6
    Unit Identifier: 0
Modbus
    .000 0011 = Function Code: Read Holding Registers (3)
    Reference Number: 23
    Word Count: 33
[Community ID: 1:Sn8QBGRGdyuEs/mCE5khRYwl30Q=]

No.     Time           Source                Destination           Protocol Length Info
     39 21.351479      10.0.0.100            10.0.0.200            Modbus/TCP 129    Response: Trans:     7; Unit:   0, Func:   3: Read Holding Registers

Frame 39: 129 bytes on wire (1032 bits), 129 bytes captured (1032 bits) on interface \Device\NPF_{EFB199C7-A164-4748-BBF5-7ACCADB51238}, id 0
    Interface id: 0 (\Device\NPF_{EFB199C7-A164-4748-BBF5-7ACCADB51238})
    Encapsulation type: Ethernet (1)
    Arrival Time: Aug 16, 2022 17:37:29.236247000 Malay Peninsula Standard Time
    [Time shift for this packet: 0.000000000 seconds]
    Epoch Time: 1660642649.236247000 seconds
    [Time delta from previous captured frame: 0.092751000 seconds]
    [Time delta from previous displayed frame: 0.104172000 seconds]
    [Time since reference or first frame: 21.351479000 seconds]
    Frame Number: 39
    Frame Length: 129 bytes (1032 bits)
    Capture Length: 129 bytes (1032 bits)
    [Frame is marked: False]
    [Frame is ignored: False]
    [Protocols in frame: eth:ethertype:ip:tcp:mbtcp:modbus]
    [Coloring Rule Name: TCP]
    [Coloring Rule String: tcp]
